{
  "schema_version": 1,
  "edition": "ai",
  "registry_id": "ai-primary-source-startpoints",
  "as_of": "2026-08-04",
  "purpose_ko": "AI 모델·평가·학습 및 서빙 시스템의 변화를 발견한 뒤 주장과 가장 가까운 원문으로 이동하기 위한 공개 seed 목록이다.",
  "relation_policy_ko": "primary는 소유 주체가 자기 모델·코드·측정을 설명하는 원문, secondary는 다른 주체의 주장을 독립적으로 시험하는 출발점이다. 실제 등급은 claim마다 다시 판정한다.",
  "selection_policy": {
    "technical_scope_only": true,
    "imports_current_affairs_sources": false,
    "popularity_used": false,
    "rule_ko": "시사판의 매체 성향·커뮤니티 균형이나 인기 순위를 가져오지 않고 버전, 방법, artifact, 평가 조건으로 이어지는 기술 원문만 선정한다. 등록 source는 강제 체크리스트가 아닌 발견 출발점이며, 지역·언어·회사 인지도에 치우치지 않고 등록 밖의 공식 원문도 탐색한다."
  },
  "forbidden_imports": ["newsroom/sources.md"],
  "sources": [
    {
      "id": "openai-deployment-safety-hub",
      "name": "OpenAI Deployment Safety Hub",
      "source_type": "model-system-card",
      "canonical_url": "https://deploymentsafety.openai.com/",
      "owner": {
        "name": "OpenAI",
        "kind": "vendor"
      },
      "default_relation": "primary",
      "relation_notes_ko": "OpenAI가 배포한 모델의 system card와 자체 평가에는 P1 원문이지만 경쟁 모델 대비 우월성의 독립 근거는 아니다.",
      "evidence_codes": ["P1"],
      "access": {
        "status": "public",
        "requires_authentication": false,
        "requires_payment": "no",
        "constraints_ko": "공개 웹 문서다. 문서가 갱신될 수 있으므로 모델명, 게시일과 문서 버전을 함께 저장한다."
      },
      "conflict_of_interest": {
        "possible": true,
        "notes_ko": "모델 개발·판매 주체가 자체 안전성과 성능을 평가한다."
      },
      "collection_notes_ko": "개별 card의 PDF 또는 고정 URL, 게시일, 갱신 이력을 보존한다.",
      "last_verified_at": "2026-07-20"
    },
    {
      "id": "openai-api-changelog",
      "name": "OpenAI API changelog",
      "source_type": "release-notes",
      "canonical_url": "https://platform.openai.com/docs/changelog",
      "owner": {
        "name": "OpenAI",
        "kind": "vendor"
      },
      "default_relation": "primary",
      "relation_notes_ko": "OpenAI가 API 모델·기능·사용 조건 변경을 공지하는 P1 원문이며 자체 성능 설명은 독립 평가가 아니다.",
      "evidence_codes": ["P1"],
      "access": {
        "status": "public",
        "requires_authentication": false,
        "requires_payment": "no",
        "constraints_ko": "공개 changelog다. 항목별 날짜, 모델 ID, 연결 문서와 확인 시각을 함께 기록한다."
      },
      "conflict_of_interest": {
        "possible": true,
        "notes_ko": "API 제공자가 자기 제품의 변경과 성능을 설명한다."
      },
      "collection_notes_ko": "일일 발견 단계에서 새 모델·API·가격·지원 종료 항목을 확인하고 정확한 모델 ID로 원문을 고정한다.",
      "last_verified_at": "2026-08-04"
    },
    {
      "id": "anthropic-system-cards",
      "name": "Anthropic Model System Cards",
      "source_type": "model-system-card",
      "canonical_url": "https://www.anthropic.com/system-cards",
      "owner": {
        "name": "Anthropic",
        "kind": "vendor"
      },
      "default_relation": "primary",
      "relation_notes_ko": "Claude 모델의 능력·안전 평가와 배포 판단을 설명하는 P1 원문이며 자체 benchmark 해석은 독립 검증이 필요하다.",
      "evidence_codes": ["P1"],
      "access": {
        "status": "public",
        "requires_authentication": false,
        "requires_payment": "no",
        "constraints_ko": "목록과 연결된 문서는 공개되어 있다. PDF 교체 가능성 때문에 파일 해시와 확인일을 남긴다."
      },
      "conflict_of_interest": {
        "possible": true,
        "notes_ko": "Claude 개발사가 자기 모델의 평가 범위와 공개 항목을 선택한다."
      },
      "collection_notes_ko": "모델명과 card 날짜를 key로 삼고 수정본은 이전 파일을 덮지 않는다.",
      "last_verified_at": "2026-07-20"
    },
    {
      "id": "anthropic-release-notes",
      "name": "Anthropic release notes",
      "source_type": "release-notes",
      "canonical_url": "https://docs.anthropic.com/en/release-notes/overview",
      "owner": {
        "name": "Anthropic",
        "kind": "vendor"
      },
      "default_relation": "primary",
      "relation_notes_ko": "Anthropic이 Claude API·모델·도구 변경을 공지하는 P1 원문이며 자체 능력 평가는 별도 검증이 필요하다.",
      "evidence_codes": ["P1"],
      "access": {
        "status": "public",
        "requires_authentication": false,
        "requires_payment": "no",
        "constraints_ko": "공개 release note다. 항목 날짜, 모델 alias와 고정 모델 ID를 분리해 기록한다."
      },
      "conflict_of_interest": {
        "possible": true,
        "notes_ko": "Claude 제공자가 자기 API와 모델의 변경을 설명한다."
      },
      "collection_notes_ko": "일일 발견 단계에서 모델 출시·지원 조건·API 변경을 확인하고 system card와 교차 확인한다.",
      "last_verified_at": "2026-08-04"
    },
    {
      "id": "google-deepmind-model-cards",
      "name": "Google DeepMind Model Cards",
      "source_type": "model-system-card",
      "canonical_url": "https://deepmind.google/models/model-cards/",
      "owner": {
        "name": "Google DeepMind",
        "kind": "vendor"
      },
      "default_relation": "primary",
      "relation_notes_ko": "Gemini·Gemma 등 Google 모델의 설계, 평가, 용도와 한계에 관한 P1 원문이며 모델 간 비교는 별도 I1이 필요하다.",
      "evidence_codes": ["P1"],
      "access": {
        "status": "public",
        "requires_authentication": false,
        "requires_payment": "no",
        "constraints_ko": "공개 목록이지만 card가 사후 갱신될 수 있어 published/updated 날짜와 PDF를 함께 기록한다."
      },
      "conflict_of_interest": {
        "possible": true,
        "notes_ko": "모델 소유자가 자체 평가 방법과 공개할 한계를 결정한다."
      },
      "collection_notes_ko": "목록의 변경일과 개별 card URL을 분리해 수집한다.",
      "last_verified_at": "2026-07-20"
    },
    {
      "id": "google-gemini-api-changelog",
      "name": "Google Gemini API changelog",
      "source_type": "release-notes",
      "canonical_url": "https://ai.google.dev/gemini-api/docs/changelog",
      "owner": {
        "name": "Google DeepMind",
        "kind": "vendor"
      },
      "default_relation": "primary",
      "relation_notes_ko": "Google이 Gemini API 모델·기능·지원 상태를 공지하는 P1 원문이며 자체 benchmark는 독립 근거가 아니다.",
      "evidence_codes": ["P1"],
      "access": {
        "status": "public",
        "requires_authentication": false,
        "requires_payment": "no",
        "constraints_ko": "공개 changelog다. preview와 stable, 지역 availability, 모델 ID와 날짜를 함께 기록한다."
      },
      "conflict_of_interest": {
        "possible": true,
        "notes_ko": "Gemini 제공자가 자기 API와 모델 변경을 설명한다."
      },
      "collection_notes_ko": "일일 발견 단계에서 신규·폐기 모델과 API 변경을 확인하고 관련 model card·문서로 이동한다.",
      "last_verified_at": "2026-08-04"
    },
    {
      "id": "qwen-official-blog",
      "name": "Qwen official blog",
      "source_type": "release-notes",
      "canonical_url": "https://qwenlm.github.io/blog/",
      "owner": {
        "name": "Qwen",
        "kind": "vendor"
      },
      "default_relation": "primary",
      "relation_notes_ko": "Qwen 팀이 모델·API·연구 공개를 설명하는 P1 원문이며 자체 평가 수치는 독립 비교가 아니다.",
      "evidence_codes": ["P1"],
      "access": {
        "status": "public",
        "requires_authentication": false,
        "requires_payment": "no",
        "constraints_ko": "공개 blog다. 게시일, 정확한 모델명, 연결된 model card와 저장소를 함께 기록한다."
      },
      "conflict_of_interest": {
        "possible": true,
        "notes_ko": "Qwen 개발 주체가 자기 모델의 변경과 평가 결과를 설명한다."
      },
      "collection_notes_ko": "일일 발견 단계에서 새 게시물을 확인하고 모델명 표기와 공개 artifact URL을 원문 단위로 보존한다.",
      "last_verified_at": "2026-08-04"
    },
    {
      "id": "qwen-model-registry",
      "name": "Qwen Hugging Face model registry",
      "source_type": "model-registry",
      "canonical_url": "https://huggingface.co/Qwen/models",
      "owner": {
        "name": "Qwen",
        "kind": "vendor"
      },
      "default_relation": "primary",
      "relation_notes_ko": "Qwen 공식 조직의 model card와 weight·config artifact를 확인하는 P1/P2 원문이다.",
      "evidence_codes": ["P1", "P2"],
      "access": {
        "status": "public",
        "requires_authentication": false,
        "requires_payment": "no",
        "constraints_ko": "공개 모델 목록이다. moving revision 대신 model ID, commit SHA, 파일 hash와 license를 기록한다."
      },
      "conflict_of_interest": {
        "possible": true,
        "notes_ko": "모델 개발 주체가 model card와 공개 artifact를 관리한다."
      },
      "collection_notes_ko": "최근 생성·갱신 모델을 발견한 뒤 blog 발표, model card, commit과 weight 공개 범위를 대조한다.",
      "last_verified_at": "2026-08-04"
    },
    {
      "id": "deepseek-github-organization",
      "name": "DeepSeek GitHub organization",
      "source_type": "code-repository",
      "canonical_url": "https://github.com/deepseek-ai",
      "owner": {
        "name": "DeepSeek",
        "kind": "vendor"
      },
      "default_relation": "primary",
      "relation_notes_ko": "DeepSeek 공식 조직의 repository, tag, code와 technical report 연결을 확인하는 P2 원문이다.",
      "evidence_codes": ["P2"],
      "access": {
        "status": "public",
        "requires_authentication": false,
        "requires_payment": "no",
        "constraints_ko": "공개 GitHub 조직이다. repository 생성·갱신일은 발표일과 다를 수 있어 tag와 문서를 함께 확인한다."
      },
      "conflict_of_interest": {
        "possible": true,
        "notes_ko": "모델 개발 주체가 자기 코드와 공개 범위를 관리한다."
      },
      "collection_notes_ko": "일일 발견 단계에서 새 repository와 release를 확인하고 exact commit, license와 model artifact를 연결한다.",
      "last_verified_at": "2026-08-04"
    },
    {
      "id": "deepseek-model-registry",
      "name": "DeepSeek Hugging Face model registry",
      "source_type": "model-registry",
      "canonical_url": "https://huggingface.co/deepseek-ai/models",
      "owner": {
        "name": "DeepSeek",
        "kind": "vendor"
      },
      "default_relation": "primary",
      "relation_notes_ko": "DeepSeek 공식 조직의 model card와 weight·config artifact를 확인하는 P1/P2 원문이다.",
      "evidence_codes": ["P1", "P2"],
      "access": {
        "status": "public",
        "requires_authentication": false,
        "requires_payment": "no",
        "constraints_ko": "공개 모델 목록이다. 정확한 model ID, revision, license, 파일 공개 범위와 갱신일을 기록한다."
      },
      "conflict_of_interest": {
        "possible": true,
        "notes_ko": "모델 개발 주체가 model card와 공개 artifact를 관리한다."
      },
      "collection_notes_ko": "최근 생성·갱신 모델을 GitHub·technical report와 대조하고 파생 모델을 원 발표와 구분한다.",
      "last_verified_at": "2026-08-04"
    },
    {
      "id": "mistral-product-changelog",